{
  "schemaVersion": 1,
  "runId": "20251215-102530_BTC-USDT_k3f7a",
  "stepId": "charts:1M:ctpl_default_v1",
  "createdAt": "2025-12-15T10:26:12Z",
  "symbol": "BTC/USDT",
  "timeframe": "1M",
  "minImages": 2,
  "requested": [{ "chartTemplateId": "ctpl_default_v1" }],
  "items": [
    {
      "chartTemplateId": "ctpl_default_v1",
      "kind": "price",
      "generatedAt": "2025-12-15T10:26:12Z",
      "png_gcs_uri": "gcs://ARTIFACTS_BUCKET/runs/20251215-102530_BTC-USDT_k3f7a/charts/1M/ctpl_default_v1/20251215-102612__BTC-USDT__1M__ctpl_default_v1__price.png"
    },
    {
      "chartTemplateId": "ctpl_default_v1",
      "kind": "volume",
      "generatedAt": "2025-12-15T10:26:12Z",
      "png_gcs_uri": "gcs://ARTIFACTS_BUCKET/runs/20251215-102530_BTC-USDT_k3f7a/charts/1M/ctpl_default_v1/20251215-102612__BTC-USDT__1M__ctpl_default_v1__volume.png"
    }
  ],
  "failures": []
}


